review,rating,date,bank,source,contains_emoji,review_length
"I feel good, it is time and energy saving and also the first platform to digitalization of the financial issue. I want to remanid the developers to make more accessible and add more feature to it!",5,2023-07-26,CBE Mobile Banking,Google Play,False,196
"I love this app, it is easy to use and makes my life easier. Sometimes it says time out but sends money and sends agin. To send for other banks it is almost difficult and for other telbirr customers not totally possible yet. If these issues solved, the app is supper 5 star.",5,2022-12-12,CBE Mobile Banking,Google Play,False,274
"CBE, please fix this app or you'll be left behind. Considering this was one of the first banking apps in Ethiopia, most bugs should have been fixed by now. But bugs still abound. It worked from outside Ethiopia but not for long. I haven't been able to use it (from outside Ethiopia) for the past 4 weeks. No updates visible. Nothing against the country that I dearly love. But this app is the one-eyed version as far as banking apps go. You know... a one-eyed man is a king...",3,2021-06-28,CBE Mobile Banking,Google Play,False,476
"I've been using this app for quite some time now and recently I've been seeing some unusual bugs, like saying error repository report, not syncing when I transfer to another account but then when I try it again, sent complete but has sent to that account twice... deducted twice...this needs to fixed ASAP...",2,2023-08-03,CBE Mobile Banking,Google Play,False,308
"I’ve noticed two key issues with your app: 1. Username Visibility: The app doesn’t display the username, making verification difficult. Please add this feature. 2. Transaction History: Transaction history gets deleted if the app is reinstalled. This data should remain accessible unless manually deleted by the user. A ""Load More"" option for older transactions would also be helpful. These issues have caused inconvenience. Fixing them would greatly improve the user experience. Thank you.",5,2024-12-01,CBE Mobile Banking,Google Play,False,489
"The CBE Mobile Banking App has truly exceeded my expectations. It offers a seamless and reliable banking experience right at my fingertips. From checking my account balance to transferring funds, the app performs flawlessly every time. It's impressive.",5,2023-12-16,CBE Mobile Banking,Google Play,False,252
"Nothing is working after the last update. Please fix it. With the previous version, when transfering money, it shows error message while the transfer is already made. It is causing unnecessary double transfers.",3,2023-10-12,CBE Mobile Banking,Google Play,False,210
"1. Withdrawal messages are not received regularly 2. Apps need to be more friendly use in terms of operation, 3. Apps lack some advanced security features, Additional comment: 4. Now that we are using modern technology, requirements for Bank Book should fade away with time. Some Branch offices do not entertain customers w/out Bank Book. Thanks and best regards",3,2022-03-08,CBE Mobile Banking,Google Play,False,362
I have been using the previous version of this app. My android version is 6.0 but unfortunately this new update support android 7.0 or higher. I don't know why you choose to do that. Most famous app here in google play are still support devices starting from version 4.0. considering most of the users to be from Ethiopia I don't think you will target almost all of the customers with the current lowest version support. Please address this issues we are facing.,2,2020-09-11,CBE Mobile Banking,Google Play,False,462
"This ought to be a major update in a while. The graphical user interface has been well improved. However, a very important feature that used to exist in the old versions, which used to allow the user to transfer money within his own accounts in the CBE at ease has to be reinstated back.",3,2020-06-29,CBE Mobile Banking,Google Play,False,287
"Since I started using this app it. Really helped me a lot. The CBE started some years ago and it is good progress, other foreign banks has money years experience and and the technology is theirs. Yes some inconvenience can occur the bank have to simplify it fast. Keep on going!!!",4,2022-12-15,CBE Mobile Banking,Google Play,False,280
"What a trash app! Trash! Trash! Trash! Whenever you want to use the app after once you uninstall it, or receive it from someone else, it will ask you for a new verification. Again, after you clear the cache and data, you will be required to ask a verification code from the nearby bank physically too! What a shame! Never use this app! Your account pass code is unsecure in this app. STOP using this app! I Do!",1,2024-09-10,CBE Mobile Banking,Google Play,False,410
"It cannot start. The old version was working perfectly. I am currently out of Ethiopia and cannot go to the bank to see what is the problem. Now I have no access to my account and with coronavirus travel restrictions, cannot go back to Ethiopia either. Is it possible to get an authorization key so that user can remotely reinstall/register the app?",1,2020-07-23,CBE Mobile Banking,Google Play,False,349
"With your new CBE mobile app version, it is gonna be alright and much interactice I hope. However, using it in weaker internet connection is often tiring... 4 issues... 1. One thing, please allow the use to subscribe or unsubscribe from the service without the subscriber requiring him to come to your office in person.... 2. You may also introduce two-factor authorization, like if someone even has got your pin, 3. Consider includng water billing and 4.update your apps often work on improvements",3,2020-06-26,CBE Mobile Banking,Google Play,False,498
"1.Very unstable, continuously crashes. 2.There is an incredible amount of balance and transaction synchronization errors. 3.Have tries to make a transfer of 60k since yesterday still not able to due to errors popups with no message to explain error. For a bank, that is quite embarrassing and dangerous.",1,2024-03-09,CBE Mobile Banking,Google Play,False,303
It is a a much better App than other Private Banks. But you have to include the following options; 1. The Bank Statement should be Unlimited. It should allow to see all Transactions by Tracing Back. No Need to Limit it with only one Page Transaction (May be 10Page). 2. You have to Work on transferring Money to other Banks too. You can ask additional payment for it. But the Service will be Essential for Us.,5,2021-09-21,CBE Mobile Banking,Google Play,False,409
"I have not seen anything like it in the Ethiopian banking industry. It is very easy to use, fast, and offers a wide range of services. However, I would like to suggest a future modification: currently, the app only displays transactions for one month. It would be beneficial if it could show transactions for more than one month, including yearly transactions. Please consider this request. Thank you, Commercial Bank of Ethiopia, for this innovative app.",5,2024-07-19,CBE Mobile Banking,Google Play,False,455
"This has so many bugs and doesn't update transaction logs in time, to make it worse it shows error message when you send money but deducts from account at same time but never lets you know that the transaction was successful. And it has very annoying greeting notification.",2,2024-08-09,CBE Mobile Banking,Google Play,False,273
We're going to stop using not only this apk additional to stop all CBE services. bcz of when to use the apk it doesn't work properly/ doesn't sync /.... + started from last 2 months they're cut 5 birr without our permission for commission. + Cut 10 birr from us when transfer to telebirr... Uuuu CBE'jobs,1,2024-03-12,CBE Mobile Banking,Google Play,False,304
"I have been using this app fair smoothly till the last update few days back and now it is a disaster as it repetitively says 'unable to sinc ' and when I uninstalled it and tried to re-install with proper procedure guided from my CBE branch, it again and again fails to accept verification code ...it is quite a disappointment !",1,2020-09-15,CBE Mobile Banking,Google Play,False,328
I have been using this app for the past 2 years and I never had faced this kind of problem The problem is when you want to transfer it always says error or account pending then you think it didn't work unfortunately when you check your balance again it's already deducted,1,2022-11-04,CBE Mobile Banking,Google Play,False,271
"It's full of crashing features, can't sync real time need 3,4 touching doesn't work many times. In fact it's not working now I'm afraid if I uninstalled it I will be forced to go to the branch to activate it again so here I'm stuck with the app unable to access my money",1,2024-03-14,CBE Mobile Banking,Google Play,False,270
Poor application most times it says error while sending then it actually sent money so u have to double check if its an error or it sent cash. recent transaction don't update as fast sometimes it even misplaces date and bring forth a transaction done a day or 2 back at the top.the only thing remotely good is the UI interface,1,2024-04-12,CBE Mobile Banking,Google Play,False,326
"This app is not set up for diaspora users. It works fine until you needed a new verification code, or you change your cell phone and try to use the app on the new phone. You will not be able to get the verification key that it is asking for just for changing your phone. It requires you to go the nearest branch to get the verification key. For me this will be travelling to Ethiopia from USA just to get this code. Even my sister - a joint aact holder & has my Power of Attorney, could not help me.",1,2024-10-11,CBE Mobile Banking,Google Play,False,499
"I am extremely disappointed with this App. Every time I try to change my PIN, I receive an error message saying ""unable to connect to server."" Additionally, my transaction processes always fail. As a well-known company, I expected better service from CBE.",1,2023-11-11,CBE Mobile Banking,Google Play,False,255
"Dear all, if you're an iOS user then the new update doesn't work at all. Those of you who use the Android App and you've been having troubles your user credentials have expired that's why it doesn't even load your balance, so you need to go to your branch and have them fix that!",1,2021-05-18,CBE Mobile Banking,Google Play,False,279
"App needs lots of updates to accomodate more demographic for Ethiopians leaving overseas. - Ability to use user name and password to use the application. People leaving over seas if they lose their phone, they can't have access to the application again unless u got to Ethiopia and activated it on the new phone! That's rediocoulus. - This application seems like it's a transfer application, not a bank application. I should be able to do more things such as viewing bank statements and more....",3,2024-08-21,CBE Mobile Banking,Google Play,False,495
The fast and easy to use app there is nothing to deny aboutt that... but it has a serious issue on showing transaction history like if i send or receive money i ll find the transaction history after a day. When the sms message is not working at some days the issue get worse like we dont have an idea how much money we have received. I dont this this issue is hard to fix for you hope you will fix it on the next update....the app deserve 4stars tbh but i just want you to see this seriously thankyou,1,2024-09-11,CBE Mobile Banking,Google Play,False,500
"My internate banking is not allowing me to transfer to another bank. While having this app, the application asks me to contact a nearby nmbranch. Don't save your money trysting this application. It is so bad! It doesn't even have help icon included. I dislike this up.",1,2022-02-04,CBE Mobile Banking,Google Play,False,268
"Good mobile banking application except some bugs. For instance, when I transfer money from account to account, an error message called 'already existed account' appears. But the money was transferred without any confirmation message. If I was not aware of that, I tried multiple times and sent the money multiple times too.",5,2023-01-06,CBE Mobile Banking,Google Play,False,323
"I used this app for a long time , and i like it, its user friendly, not complicated at all, and more over it makes life easier for real. But the now after some times, this app is working better only on wifi, .. its veary hard to use it with mobile data, so please do something",3,2021-06-08,CBE Mobile Banking,Google Play,False,276
"This one is better than the previous versions. But am unable to send to benficiaries, it was working on the previous versions. While working on the other features please work on this failure too. Thank u!",4,2021-08-24,CBE Mobile Banking,Google Play,False,204
"I would have given the app 5 stars if the download or share function of the last transaction confirmation is working. I wonder why you desabled it as I repeatedly obliged to screenshot the confirmation. If I were you, enable is as even pdf file to print and file. I hope you will correct by updating it.",4,2022-05-30,CBE Mobile Banking,Google Play,False,303
Can't use this app after unsubscibing previous phone holders account and reinstalling. While I enter pin and activation code it says failed to authenticate and finally blocks the pin after 3 trials. I have been retried more than 3 times and finally gets stuck. Pls help.,4,2020-11-01,CBE Mobile Banking,Google Play,False,270
"The app is good. However, whenever you changed your phone it requires authorization ID, approaching a branch is mandatory. The password reset option should be available to the user by adding other security details like user name, biometrics, account number, etc.",3,2023-03-10,CBE Mobile Banking,Google Play,False,262
"The app got dumber in the last update. Poorly organized, redundant item across different categories. I wrote this review with my phone barred from calls because I couldn't settle my bill from your old ""utilities"" or the newly added ""utility"" tab.",1,2024-03-06,CBE Mobile Banking,Google Play,False,246
"The old one was very bad and clumsy. every time I tried to login there was a problem with synchronization, because of that I was close to clear my account from CBE and open a new one in privet bank, as they cares about their customers. In other hand the new one is perfect and shows a little bit reformation in the Headquarter and this makes us to trust this bank again.",4,2020-08-01,CBE Mobile Banking,Google Play,False,370
"As a financial app, the app should be more sensetive for any action. When i do some transaction, it shows error message. But the transaction already done at the back. If you see error messages, it may not be error. Automatically stop doing any action see your balance and wait for your sms.",1,2022-11-01,CBE Mobile Banking,Google Play,False,290
"Won't update my account balance, severely out of sync. When I checked at the ATM it was a completely different number. General cbe problem, but the transactions take 10 days to post from a POS transaction. Makes t extremely difficult to use.",1,2023-12-14,CBE Mobile Banking,Google Play,False,241
It is a very good application. It works better than any other applications i came across. I have seen much progress since the first time i started using it. Still it needs some improvement with connectivity issues.,4,2023-01-03,CBE Mobile Banking,Google Play,False,214
"the App is one of the BEST things to have in Ethiopia but one of major problems is shows incorrect statements and incorrect available balance, merchants and supermarkets doesn't deduct right away 😑 deductible may come after weeks or month, once u already forgot about it and so many things to work on. please take it seriously Thanks 😊",3,2022-11-16,CBE Mobile Banking,Google Play,True,335
"I am so disappointed because the application doesn't clearly show how many birr it will charge for every transaction rather than just deducted the money , as a user we should have the right to know the amount of money that is going to be deducted. It is a very deceptive tactic , it should be improved immediately.",1,2024-12-15,CBE Mobile Banking,Google Play,False,314
"It's a beautiful app. But especially when transferring from one account to another, if a receipt is prepared stating the name of the sender and the name of the recipient and the amount of the money. Also, if people make a mistake when making a transfer, it would be nice to have a system where the mistake can be reversed.",5,2023-12-11,CBE Mobile Banking,Google Play,False,322
"The app doesn't have 1. mini statement service In my opinion, I don't have to go to cbe branch to get mini statements and transactions I have done and pay for it.why? 2. Recent transaction The app doesn't store numerous or enough recent transactions, even it doesn't store what stored properly sometimes.",1,2024-09-02,CBE Mobile Banking,Google Play,False,304
"I have one complain, why it require verification code every time when i change my phone or reinstalled the app, as you know that code i can get it only from the branch. I know that it demanded for security reason but this method could be changed by otp sms text then i enter my own PIN and log in. couldn't you send us otp (One time password)? For instance like Dashen Bank. i waste my time and money to get verification code. You seriously think about it.",1,2023-07-23,CBE Mobile Banking,Google Play,False,456
"In the beginning, the ability to capture the history was small, now it's a great job to capture all the transactions and the user can see them, another problem is that if a transaction or transfer is made, the number of the receipt will not be downloaded when saving to avoid it, unless a screenshot is taken, it would be better if you fix this.",5,2023-01-25,CBE Mobile Banking,Google Play,False,345
"I'm actually forced to review this app again, it used to work fine on any network but after the last update it doesn't work on a wifi network, what if i don't have a data on my sim card and i needed an urgent transaction be made, it really makes me angry that you guys would update it to this dictatorship, please fix this",3,2023-10-26,CBE Mobile Banking,Google Play,False,322
"I have been using CBE App for long, but recently it has started crashing repeatedly and even my phone is reporting that the app has bugs and tells me to wait the developer to fix these bugs.",1,2025-03-09,CBE Mobile Banking,Google Play,False,190
I never want to use this app. I like to type *889#. I just hated to go to the bank to activate the app. It took them 1 minute to do it. Now I just bragging I can recharge my phone with one click. Nice interface keep at it.,5,2020-09-25,CBE Mobile Banking,Google Play,False,222
It functions to the most part until you need it. The most common flaw is when you send money to another bank account. It shows error but the money is actually gone. I paid twice at least 4 times because of this.,2,2024-08-29,CBE Mobile Banking,Google Play,False,211
"It is a very nice and easy app to use. There is only one thing i would like you to add. If you could transfer from your account to another person's telebirr account, it only works to your own phone number",5,2024-05-02,CBE Mobile Banking,Google Play,False,204
"Better than pervious,Nice interface and looking. However , *better to include balance after each withdraw/deposit. *include water services ( You show it in the app but not there) *Make it Printable via bluetooth printer *",3,2020-08-18,CBE Mobile Banking,Google Play,False,221
"Terrible! I had to use it to pay for my service at Document Authentication & Registration office. I hit confirm it says try again & I hit confirm again & it ends up sending the money twice. Then I had to write a letter to the office to get my money back & it is been more than 2 weeks but I didn't get my money back yet. I talked the issue to my branch they said you are lucky the issue is with a gov't office, they would do their accounting and return your money, but there is nothing they can do.",1,2022-03-05,CBE Mobile Banking,Google Play,False,498
"After the update I received today, I have tried to conduct transfer to other CBE accounts and it continously brings error messages saying none available. It is also not allowing me to download the transacation picture as is advertised here. Please do something CBE as this app is continuing to frustrate me again and again.",3,2021-06-04,CBE Mobile Banking,Google Play,False,323
"Its amazing app , i like it specifically updated version is to smart . WOW CBE. But users have to Login without of goingto Bank after first registration . In this app If User was change His phone or uninstall app Hi have to go bank to use again, this is not good :: if this problem was fixed This app wasn't Any - comments. This is my feedback Thanks",5,2022-03-18,CBE Mobile Banking,Google Play,False,350
"grate application, simple and fast. just 2 comments. 1, on recently transaction list please make the very recent first. it lists randomly. 2, put a copy icon next to account number so that we can copy instantly.",5,2023-10-14,CBE Mobile Banking,Google Play,False,211
"Amazing, very friendly and awesome application. Only one drwaback is that you are not willy to make it active after blocking the mobile banking via 951. I am not still using once blocked. You send me to the branch banks but they don't have enough skill to help.",5,2024-05-12,CBE Mobile Banking,Google Play,False,261
"It is best application for banking system. Because it's save time, and make easy all things like, paying for other, transferring mobile charging and etc... But it's good if you add mini statement option like tele birr app, it's make full.",4,2022-05-05,CBE Mobile Banking,Google Play,False,238
"Before years later i used this app and is used to work in mobile data eventhough it doesn't have different features like this version but now it doesn't even sync my balance and even can't use any of the services it says "" can't sync "" and "" none available "" 😡🤬😡",1,2020-12-16,CBE Mobile Banking,Google Play,True,262
"It is a user friendly and helpful app. It has greatly helped my day to day activities. However, it requires improvement on the weekly transaction limitations and it sometimes crashes.",4,2023-05-02,CBE Mobile Banking,Google Play,False,183
"Very unsafe! The password is stored in the phone, which is very unsafe. And once you entered the password, there is no timeout nor ask for password while making transaction. Therefore, if you have stolen your phone, you may end-up loosing your money",1,2021-10-13,CBE Mobile Banking,Google Play,False,249
"""get your verification code from your nearest branch"" ia the first amazing dialogue your face, when you try to setup your CBE App. It is a way back system that requires you to go physically. You should have sent a verification codes either via phone number or email address. You better change this analogue system to the digital one! 😀",2,2024-07-13,CBE Mobile Banking,Google Play,True,335
"It worked fine until I have received an SMS with a link to update the app, it directs me to play store having Open and uninstall options which when I choose open kept bringing me back to the interface of the app I already have.",1,2022-02-12,CBE Mobile Banking,Google Play,False,227
"It's very bad. It deserves 0 stars. It doesn't show some transactions,it misplace transactions,it misplace dates,it shows nonsense errors and so more. I just rate it to 2 stars for helping me a lot.",2,2024-04-14,CBE Mobile Banking,Google Play,False,198
"This app is good and easy to use UI. But, still need some bug fix such as own account transfer and payment to beneficiaries didn't work. Localization also not yet work like date conversion...",4,2020-11-10,CBE Mobile Banking,Google Play,False,191
I wasn't able to try your app because while opening the app it's says your device is rooted. Even if it's a precaution incase of hacking but my device is not rooted. I even disable OEM unlocking but the error is still there.,1,2020-10-27,CBE Mobile Banking,Google Play,False,224
"1. It is good, flexible, simple and easy. But it can't serve offiline and didn't compliment with the ussd *889# 2. Checking Account balance is off and hidden under transfer.",4,2024-01-17,CBE Mobile Banking,Google Play,False,173
"Can developers present options to see transactions details like locations ( city ) or CBE branches where transactions are initiated or identity who wired transfers rather than simple generic term ""transfer"" ? This option helps to track cash in flows without going to nearby CBE branch to learn details of a transaction. Apart from this, the app is great and make life easy.",4,2021-09-03,CBE Mobile Banking,Google Play,False,373
It's the worst! I just transfer from my cbe account in to my tele birr account for urgent case but unfortunately it holds. And there customer service workers told me it will be returned in to my cbe account after 3 or 5 working days if its not credited in to my telebirr account. How's that working? This bank is a pioneer in from the country. It's really annoying this happens for second time. Please amend your network services. Am totally annoyed by cbe.,1,2024-09-07,CBE Mobile Banking,Google Play,False,457
Very poor app. I had to make 8 transfers of the same amount as the app did confirm success of the first or second or third etc. transfers. I had to pay etb 13 birr 8 times each for service charge.,1,2024-02-02,CBE Mobile Banking,Google Play,False,196
"I have seen lots of issues on this app one of them is you can't use them in multiple device and you have to go to the place you opened your account in order to get mobile banking even if you change you device you have to go to the branch to activate it, why can't you just make it easy like the others banking system in Ethiopia. You should learn from abbisinia and dashen to be honest",1,2022-10-18,CBE Mobile Banking,Google Play,False,385
