review,rating,date,bank,source,contains_emoji,review_length
Can you please just make it functional. I don't think anyone cares how good it looks if not a single functionality works. Plus it's not even aestheticaly nice. The loading animated icon has white irregular edges because the logo wasn't cut out correctly. The app doesn't work at all. It doesn't even login. It gets stuck on login just showing the logo animation and blames the issue on connectivity. Connectivity is fine and the proof is that this review is posted.,1,2024-04-15,Bank of Abyssinia,Google Play,False,465
"Terrible Bank Experience It’s unbelievable that with all the modern technology, this bank still struggles with even basic transactions. The app constantly crashes, services are limited, and every time I try to transfer money or load Telebirr, there’s a huge delay. I have to wait 5 days for failed transactions to be refunded! Even USSD is unreliable. They’ve put me in embarrassing situations countless times, and customer care never fixes anything. I’ve switched banks, and you should too!",1,2024-10-14,Bank of Abyssinia,Google Play,False,491
"I have a worst experience while using this mobile application through out the year. Most of the time it fails to ""Login"" or automatically closed the app. And also it takes so much loading time (5 minutes +) trying to access the internal services. Sometimes also while transferring within and to other bank also fails. So, BOA please fix your app.",1,2024-11-29,Bank of Abyssinia,Google Play,False,346
"It crashes frequently. It launches on Android 8.1 but I don't think it actually works on versions less than 10. If so, it shouldn't be available for download by such devices to begin with, like many other finance apps are not. It was so much better three months ago, upgrades should be for the better.",1,2024-09-06,Bank of Abyssinia,Google Play,False,301
"Developers/ the company takes too long to update the app, and throughout that process, the app is basically useless. We can't send money or even be able to check our account. They even take it down from the Play Store for a while. This whole process usually takes them 3 to 5 days. This is very disappointing. It is an improvement from the previous version of the app, but they still have a long way to go to compete with the likes of CBE. Transferring to other banks sometimes doesn't work.",2,2024-05-03,Bank of Abyssinia,Google Play,False,491
"Why the app doesn't allow to update the previous version. In addition to this, when I install the new version and try to activate, the app doesn't allow to write the activation OTP code to the screen. I have received the OTP password from telegram and email. Would you please fix this bug. Thank you",1,2024-02-03,Bank of Abyssinia,Google Play,False,299
"This app future is good, but there is problems with apps to reset and activate it, which is difficult even to the branch staffs, and it takes too long times to active at the branch plus most of the time high expected failure of activation after process at the counter and OTP sent not work",1,2025-05-06,Bank of Abyssinia,Google Play,False,289
"This app has been found useless while I compared with the first version of IB12111...that was very good, you guys what is the matter with you. You are far from the technology and the competetor's digital product through convenience, reliable, easeness _-dashen, cbe, zemen... they are doing well! share their experience and be able to satisfy your esteemed customers including me. unless you will be down soon!",1,2024-04-29,Bank of Abyssinia,Google Play,False,410
"I will give only one star, because it faced with multiple of problems. 1. The app is not as fast as the other banks App, for e.g like CBE 2. The App asks repeatedly to switch off developer options, even if it is switched off. 3. Bank of Abyssinia's services are interesting, but they ignored the issues on the App service. 4. Most customers gave a complain on the App, but no one accept their complain to fix the issue. 5. Lastly, I will not recommend the App unless the issue has been solved ASAP!!",1,2025-01-03,Bank of Abyssinia,Google Play,False,499
This app is incredibly frustrating to use. It’s filled with issues that make it difficult to navigate and complete tasks efficiently. I’ve never encountered such a poorly designed banking application before. It needs significant improvements to enhance user experience. It deserves a vey low rating.,1,2024-09-26,Bank of Abyssinia,Google Play,False,299
"The version 24.04.26 is not opening on any of my devices. I noticed this issue on my friend's Android 9 phone and also on my Samsung Android 12 phone. Even after weekly updates, the newest version is not working properly. Please provide a stable version update, as I prefer the older version of the app from the new one.",1,2024-05-04,Bank of Abyssinia,Google Play,False,320
"So BoA, your last application was horrible and buggy. And we thought ""finally!! a functional new app with better UI."" But It didn't last long, a non existent connection error at login.... Please just fix your app to the simplest functional form and it would be up to your other service standards.",1,2024-04-21,Bank of Abyssinia,Google Play,False,296
OMG this is like the worst mobile banking app ever. I have many different mobile banking app from different banks but this is the worst so far. It says it has connection issue when I have wifi or data connection and while I'm using other social media apps. It keeps asking me for update once like every week and takes forever to load like I have to wait at least 10 minutes to login and another 10 min to see my balance.,1,2024-05-02,Bank of Abyssinia,Google Play,False,420
"Was working fine for 2 days then Error the request was not successful please check your connectivity or try again my connection works perfectly i reinstalled the app called support multiple times all of them said it's a system problem be patient it has been a week since then, called again they even dared to say the problem is your phone restart it which i did but still the same other banking apps work perfectly but this my experience with this app, horrible the whole system is bad",1,2024-02-14,Bank of Abyssinia,Google Play,False,485
"This is a much better app from BOA, easy to activate with ATM credit info, that helps someone like myself who already forgots previous PIN No or IB password. Apps runs fast unlike the previous versions. I hope you don't ruin it with unnecessary update. Please notify customers to use this app through their SMS.",5,2024-01-18,Bank of Abyssinia,Google Play,False,311
"The app does not work well from abroad, there have been continuous upgrades and updates that are very interruptive and non-responsive. Staff do not have the technical capabilities to support whereas the support number and online support are never available.",1,2024-02-12,Bank of Abyssinia,Google Play,False,257
This app is not efficient and can't be used for people outside Ethiopia. I am not able to enter back my OTP code into the App screen as it gets frozen and nothing can be done. Also the login screen forces to enter a local cell phone in Ethiopia and a PIN number. Those of us who live abroad are left out. The previous application with BoA Authenitcater was working efficiently and I was also able to login using my LapTop. I recommend the Application to use login user name & email instead of Ph#.,1,2024-02-23,Bank of Abyssinia,Google Play,False,497
"Be careful of using this app to transfer large sums of money. Recently I can't top up my mobile card, can't pay tickets, can't transfer money to Telebirr. The *815# works but what's the use of an app if we're using USSD. It will refund your mobile top up days after failing to top up but I wouldn't want to risk that. I'm a big fan of BoA but I wouldn't recommend this app. 👎",1,2024-05-15,Bank of Abyssinia,Google Play,True,375
"Very poor app. It crashes every time, doesn't load properly, and you can't even buy airtime. The programming is subpar. Please take lessons from other online banking apps. I would give it a zero if I could!!",1,2024-05-10,Bank of Abyssinia,Google Play,False,207
"The app doesnot allow to transfer from foreign currency accounts to local currency accounts , it says transaction not allowed , please check it and also it is difficult to activate the app from abroad countries since the otp doesn't reach by sms and it uses email, it doesn't allow manual otp input and the email hardly received , please review your app and make an update !!!",2,2024-03-22,Bank of Abyssinia,Google Play,False,376
"When we come to use mobile banking app this app is the WOREST one. Who made this app? Why? im almost forget to use it While the app right infront to my phone. I preffered to go branch office rather than to use it. Let alone for transaction or other service for simple purpose to check my balance i used to call for the bank 'call center' rather than to open for this difficult app. It need high speed internet service, it stop service for simple interuption of the network, after transfer the 1/2",1,2024-02-13,Bank of Abyssinia,Google Play,False,496
"Please add an option to manually input the OTP. I am residing outside of Ethiopia. I encountered difficulty accessing my account following the recent update (change) of your mobile banking app. Unfortunately, I am unable to activate the app on my mobile device. During the activation process, the app prompts for an OTP, which I can receive via Telegram. However, there is no option to manually input the OTP. I kindly request your assistance in resolving this matter and activating my account",3,2024-02-03,Bank of Abyssinia,Google Play,False,493
"It's been two months now, I cannot do any transaction using this app. It's really disappointing. I am using bank of Abyssinia currently because it's the nearest bank to my work place. The bank is turning to the worst bank in the country day by day. They always respond to customers that they are updating their system all year long, I think that's what they train their customer service operators to do.",1,2024-06-26,Bank of Abyssinia,Google Play,False,403
"The worst mobile banking app! It doesn't load (seems like with the perfect WiFi and data connection it still manages to have network issues), when you finally get into the app, it makes it so hard more than it should be to send money.",1,2024-05-31,Bank of Abyssinia,Google Play,False,234
"Playstore need to have some option to give 0 stars because this application right here, deserve exactly that, imagine being one of the biggest banks In the country and can't manage to have good mobile application in the Era of mobile money, you guys are in the brink of collapse you better make it right real quick or you gonna be 10 meters down to the grave. DON'T USE THIS APP, IT'S WASTE OF TIME.",1,2024-05-21,Bank of Abyssinia,Google Play,False,399
"The updated version of this app is just time wasting. It doesn't work with 2G/3G network.require log in frequently,not fast as much as possible.automatic log out are the bad features of this app",1,2024-04-13,Bank of Abyssinia,Google Play,False,194
Very unprofessional and mischievous bank in my opinion. I have had several occasions but recently I used Abyssinia Card to withdraw money and it was deducted from my account but despite reporting several times they said they are processing it but I learned yesterday that since it has been 3 months the bank has decided to include it in their income. How absurd. If you can avoid this bank.,1,2024-12-06,Bank of Abyssinia,Google Play,False,390
"This is terrible app. What the hell is your problem. Passwords can't be entered manually. I'm abroad. I don't have my Ethiopian Sim. I'm receiving the activation code via telegram. But you locked the system not to accept the activation OTP manually. Hence, I can't see my accounts, I can't make transactions etc.... how can you not think of this in advance.... now I'm in a terrible situation. I can't know what is going on with my account. WOULD YOU FIX IT NOW.... NOT TOMORROW or THE DAY AFTER...",1,2024-02-16,Bank of Abyssinia,Google Play,False,498
"This app is trash, it's not working for the past 3-4 days. I've to go to the bank to send money to other banks. Plus the app keeps crashing since the last update. BOA as a bank is deteriorating! This has to change.",1,2024-04-30,Bank of Abyssinia,Google Play,False,214
"The worst mobile banking app ever!!! I have tried to transfer 25,000 from my BOA account to my CBE and it still hasn't reached my CBE account yet. When I tried contacting customer support they just tell me it's a problem with the system. I have waited 48 hours and I still haven't received my money. Bank of Abyssinia the worst bank and system, I don't recommend this app or bank to anyone.",1,2024-03-01,Bank of Abyssinia,Google Play,False,390
It has been a while since you guys started giving the mobile app service but still couldn't get it to work. I'm sure you know that it doesn't work already but not sure if you're lazy or incompetent to fix it. You are losing business because of this. Complacency will have consequences.,1,2024-12-10,Bank of Abyssinia,Google Play,False,285
"This is the most stupid app I've seen, why would I turn off developer mode just because you can't make your app secure, this clearly indicates the app has very poor implementation and unskilled developers.. There are a lot of people who need developer option for different reasons. Please for the sake of the bank, fix this thing... Even the most secure international banking apps don't require it. Not to mention the lag and crashes",1,2024-07-12,Bank of Abyssinia,Google Play,False,433
"The app is essentially unusable, it asks to disable developer mode even when it is already disabled and crashes, sometimes it only works with wifi and sometimes only with data, or it crashes just because.......",1,2024-07-04,Bank of Abyssinia,Google Play,False,210
"This app takes too long time to be opened. And even it is not working simply as other banks application. Why this app does not give a digital invoice. Even, I am not able to find where the screeshot is kept after transaction. So, please the developer should fix all these.",1,2024-08-07,Bank of Abyssinia,Google Play,False,272
"I've never seen a very worst mobile banking system like this, i lost 37000 birr because of your delay transaction system, i called 8397 and they told me stay for confirmation but, after i changed my mind and waiting for confirmation call to cancel the process they sent it with out my approval, so please don't use the mobile banking system please",1,2024-04-23,Bank of Abyssinia,Google Play,False,347
"BOA is unreasonably holding and delaying transactions for more than a day, even transactions within the same bank itself. This is a huge gap that I observed in BOA mobile banking. I didn't experience this kind of challenge while having transactions in other banks' mobile banking platforms. After waiting so long, I called your customer support team and the response they gave me was ""it was the system that holds the transaction & will be released on working days"". This is not totally fair.",1,2024-09-15,Bank of Abyssinia,Google Play,False,492
"Installed the latest version of this app on my Android 14 device, but it is not working. I have already received the activation key from your branch (via SMS), but couldn't activate it. It is a failed app. I bet you don't have QA testers.",1,2024-04-24,Bank of Abyssinia,Google Play,False,238
"Decent, but there problems sometimes it says error When i transfer money but infact it transferred because of this bug i transferred 2 times instead of 1 and also we can't transfer money to others telebirr acc we only can to our self BOE Dev fix this !!!",3,2025-03-11,Bank of Abyssinia,Google Play,False,254
i have went to the bank so many times because i couldn't make any transaction i can only see my balance nothing else so what is the point of having mobile banking if i can't make any transaction with it please work in that,1,2025-03-21,Bank of Abyssinia,Google Play,False,222
"Worst App it ain't allowing yo activate not even in the nearest branch are able to activate it. I have been client of the bank for 10years. What is this BoA? As we know it being a leading in simplifying banking service this App needs to be fixed. Then we will give it better rate,",1,2024-02-13,Bank of Abyssinia,Google Play,False,280
"Great graphics, but why my music have to stop when I open this app? Make it make sense. But overall, it's good, but also needs too much data just to load this app. We might need a lite version of this.",3,2024-02-15,Bank of Abyssinia,Google Play,False,201
"the app used to run fine, but now it takes like forever to even open the main dashboard and sometimes it just crashes on its own. you guys gotta step it up. we need this app to be way faster",1,2024-06-27,Bank of Abyssinia,Google Play,False,190
The app keeps crashing it stops responding while I'm using it or trying to open the app. Now I have to go to the bank in person to do any banking activities. In short it is the worst mobile banking system in Ethiopia,1,2024-07-11,Bank of Abyssinia,Google Play,False,216
I have nothing against your service but your App!!!!??? When will it ever work? Why do you keep changing the interface whenever there is an update? The most unreadable annoying app.,1,2024-03-22,Bank of Abyssinia,Google Play,False,181
"I can't believe in this day and age, one of the major banks of the country can't seem to understand that having a working mobile payment option is a **MUST** to survive. I have decided to move my accounts to CBE and Awash because of this. Can't be bothered with this useless app.",1,2024-07-04,Bank of Abyssinia,Google Play,False,279
I'm disappointed with the recent changes to this app. Disabling developer options for functionality seems unnecessary. The previous version offered a more user-friendly experience.,1,2024-06-06,Bank of Abyssinia,Google Play,False,180
It's just terrible. It kept crashing in middle of transaction. Hell sometimes it won't open. My phone is stock Android (pixel 8) and I don't even know how this happens. Fix it!,1,2024-05-20,Bank of Abyssinia,Google Play,False,176
"Its nice platform when i compare with the previous version! But, when i try to use mobile banking the app states use the updated one! As it orders, i updated BOA from playstore, when i try to use mobile banking on the following day the same thing-update from the playstore!!!!",5,2024-02-20,Bank of Abyssinia,Google Play,False,276
This application is losing major factions on a daily basis. I can count how many times I have used this app; it is completely useless and disappointing if I am not going to use it in times of need then I don't see the point.,1,2024-11-28,Bank of Abyssinia,Google Play,False,224
"Unreliable, expensive service. Most of the time, it is not working. Sometimes, it will take more than a day to complete transactions and charges more for this unworthy service. I will not recommend this bank app to anyone.",1,2024-06-10,Bank of Abyssinia,Google Play,False,222
Worst mobile banking app I ever experienced I was blaming other apps but comparing with this they're too much better!!!! It clashes it takes much longer time to login while loading in short it's a complete of trash,1,2025-03-06,Bank of Abyssinia,Google Play,False,214
Why is not letting me access my account. The whole point of this app is for me to gey access to my account without physically being at the bank. I would give it a zero but a one will suffice to get my point accross.,1,2024-12-27,Bank of Abyssinia,Google Play,False,215
"please add language in the apps setting(amharic afan oromo, tigniya,and others) sometimes bank to bank transfer is not available through time and even if if it is available not reachable…it is serious issue!",1,2025-02-15,Bank of Abyssinia,Google Play,False,207
"I downloaded the app for the first time while reading other customers reviews and as soon as i installed and opened the app it closes back automatically, what unserious bank, now i uninstalled the app immediately",1,2025-03-03,Bank of Abyssinia,Google Play,False,212
I am having a challenge to use the app. The app does not allow to update the previous app. Neither does it allow to manually insert OTP - BoA please modify the app to allow these features,3,2024-02-06,Bank of Abyssinia,Google Play,False,187
"This app is way better than both Apollo and the old mobile banking app. It's super easy to use and loads really fast. If you already have boa mobile banking before, activating it is a piece of cake. Great job on making such an awesome app – keep it up !",5,2024-01-27,Bank of Abyssinia,Google Play,False,253
Worst app ever previous version was way better than this version after I activated my mobile banking app it says account not found but I'm their system my IB customer does work fine please fix your bugs and test it before you release it I have visit and report many branches and head quarter but they can't fix the problem,1,2024-03-23,Bank of Abyssinia,Google Play,False,322
I don't know why they roll out new updates without making sure it works! Why???? Do they need to update to a new staff? Perhaps pay for a better network?? Mindenew? I don't know there always a problem with this app.,1,2024-03-02,Bank of Abyssinia,Google Play,False,215
"By far the nicest looking app by an Ethiopian Bank. But it's functionality is weak. It is full of Transaction error, Function Error. Kudos, but it needs more backend work.",2,2024-04-22,Bank of Abyssinia,Google Play,False,171
A lot of the app's features have been rearranged but sometimes it works sometimes it doesnt...and that makes it less reliable specially at times of need...pls improve it,2,2024-04-18,Bank of Abyssinia,Google Play,False,169
This app is the most worst app I used in Ethiopia and belive me I know I live in Ethiopia. Being the fincial app It doesn't work when you want it. It makes you wait for cash out code and immediately debit the amount before sending the code I have got to say abysinia bank I didn't expect this from you and I use CBE mobile banking,1,2024-05-18,Bank of Abyssinia,Google Play,False,330
Hi I have problem with this App BOA mobile I don't know what is wrong with this App I did many times download but it's sam doesn't work if sam like that this app way I have to be customer with them how I know my account and checking save The book is no Not enough alone,1,2024-08-28,Bank of Abyssinia,Google Play,False,269
Sorry to say this compared to other banks mobile app its the worest it need more improvement the app doesn't match the bank standard it need more update its too slow plus it keep saying stop developing option on your phone when no developing setting enabled ??plus when it come to recent transaction nothing to display...,1,2024-05-24,Bank of Abyssinia,Google Play,False,321
My advice for whoever reading is go look for other bank(awash bank is a great example). This bank won't even allow you to access your money when you want. It has bad servers which don't work(respond) on time.,1,2024-05-11,Bank of Abyssinia,Google Play,False,208
It was working good before the last update but after the update it asks to disable developer option. why is that? That means any developer with developer option enabled can't access his account. It crushs a lot of times.,2,2024-05-01,Bank of Abyssinia,Google Play,False,220
"It say ""The request was not successful. please check device connectivity or try again"" why? One of the bank manager told me it is because of my phone's android version which is 9.1 It is ridiculous! Disappointing",1,2024-09-11,Bank of Abyssinia,Google Play,False,212
"I don't know why every time you come up with a new update the app get worst than the oldest, it is taking more time to load, can load money to telebirr, can't pay awach. Please try to fix it.",1,2024-05-02,Bank of Abyssinia,Google Play,False,191
"""I am extremely disappointed with the poor service I have received. It is unacceptable that I cannot make transactions of 30,000 Birr and sometimes my money gets stuck in the air. As a result of your incompetence, I have been forced to change my bank account. This level of service is completely unacceptable and needs to be rectified immediately.""",1,2024-05-06,Bank of Abyssinia,Google Play,False,348
"Worst app ever, not user friendly, even doesn't serve basic functionality correctly, takes to much time to login and navigate through the app, we expected more from this bank",1,2024-08-07,Bank of Abyssinia,Google Play,False,174
"Its amazing and easy to use , but from these two past days it crashes and tells me ""there is not enough connectivity"" while my internet was good enough , and i can't open it anymore !! Fix this proplem ASAP.",5,2024-03-02,Bank of Abyssinia,Google Play,False,207
"It was working fine a couple of days ago, in the utilities section of payment it only provides a few services but that is OK for now but my issue is it has started crashing down these past 2 days",2,2024-04-21,Bank of Abyssinia,Google Play,False,195
The app does not open sometimes it says coonection issue which i dont have and after it opens it has bugs while using its not smooth to work with please improve it,1,2024-07-31,Bank of Abyssinia,Google Play,False,163
Overall good app but performance needs some improvement also sometimes when using instant other bank transfers it refuses causing to be repeated several times to transfer,4,2024-10-04,Bank of Abyssinia,Google Play,False,170
I love boa but the mobile app isn't as good as the older version when the app gets update it gets worse and worse it doesn't even work..fix the issue with that,2,2024-04-28,Bank of Abyssinia,Google Play,False,159
